{
   "name": "Utilization",
   "description": "EC2 Utilization Montior",
   "allowMultiple": false,
   "signal": {
       "reporterId": 1,
       "type": "HighCpu",
       "group": "WU2-P1-0317",
       "id": "i-06a81abcd8caa4843"
   },
   "cues": [
       {
           "id": "resize",
           "name": "EC2 Resize",
           "description": "WU2P103170042 (t2.large) is 43% utilizied for the past 7 days.  Would you like to resize it?",
           "resolver": {
               "type": "Lambda",
               "action": "MyTestResolver",
               "variables": [
                   {
                       "name": "size",
                       "type": "list",
                       "options": [
                           "t2.nano",
                           "t2.micro",
                           "t2.medium",
                           "Ignore"
                       ],
                       "defaultValue": "t2.nano"
                   },
                   {
                      "name": "instanceid",
                      "type": "hidden",
                      "defaultValue": "i-06a81abcd8caa4843"
                   }
               ]
           }
       }
   ],
   "defaultCue": "resize",
   "defaultCueTimeout": 4320
}